{
  "generated_at": "2026-08-23T00:00:00+09:00",
  "reviews": [
    {
      "assistant_assessment": "SUPPORTED",
      "assistant_reason": "검증된 Evidence Registry의 계보·위험도·안내 정책과 일치한다.",
      "case_id": "RAGV2-GOLD-0001",
      "case_snapshot": {
        "evidence_match_policy": "ANY",
        "expected_guidance_policy": "PARTIAL_STOP",
        "expected_no_evidence": false,
        "expected_risk_level": "caution",
        "forbidden_document_ids": [
          "MAN-SKMAGIC-WPU-IAC425-REV02"
        ],
        "forbidden_model_codes": [
          "WPUIAC425SNW",
          "WPUJAC104SWH"
        ],
        "product_model_code": "WPUJAC104DWH",
        "query": "정수기에서 물이 나오지 않을 때 무엇을 확인해야 하나요?",
        "query_variant_type": "DIRECT",
        "source_case_ids": [
          "RAG-POS-NO-WATER"
        ]
      },
      "checks": [
        {
          "check_id": "EVIDENCE_POLICY_COHERENCE",
          "detail": "ANY",
          "status": "PASS"
        },
        {
          "check_id": "EVIDENCE_LINEAGE",
          "detail": "registry/page/section cross-check",
          "status": "PASS"
        },
        {
          "check_id": "FORBIDDEN_SCOPE",
          "detail": "target scope is not forbidden for positive cases",
          "status": "PASS"
        },
        {
          "check_id": "RISK_AND_GUIDANCE",
          "detail": "registry-derived when available",
          "status": "PASS"
        }
      ],
      "human_signoff_status": "PENDING",
      "required_human_checks": [
        "QUERY_AND_EVIDENCE_MEANING",
        "RISK_AND_GUIDANCE_APPROPRIATENESS",
        "FORBIDDEN_SCOPE_APPROPRIATENESS",
        "RECORD_REVIEWER_ID_DECISION_AND_REVIEWED_AT"
      ],
      "review_priority": "NORMAL",
      "source_review_context": [
        {
          "document_id": "MAN-SKMAGIC-WPU-JAC104D-JCC104D-REV00",
          "evidence_summary": "무출수 원인을 필터 수명, 단수, 연결 호스 꺾임으로 구분하고 조건별 안전 조치와 상담 전환을 안내합니다.",
          "evidence_unit_id": "EVD-WPUJAC104DWH-NO-WATER-001",
          "page_refs": [
            37
          ],
          "section_id": "JAC104-SECTION-TROUBLESHOOTING",
          "source_kind": "EVIDENCE_REGISTRY",
          "source_locator": "data/processed/structured/evidence/jac104_evidence_registry.jsonl",
          "verification_status": "TEXT_AND_VISUAL_VERIFIED"
        }
      ],
      "suggested_changes": []
    },
    {
      "assistant_assessment": "SUPPORTED",
      "assistant_reason": "검증된 Evidence Registry의 계보·위험도·안내 정책과 일치한다.",
      "case_id": "RAGV2-GOLD-0002",
      "case_snapshot": {
        "evidence_match_policy": "ANY",
        "expected_guidance_policy": "NORMAL",
        "expected_no_evidence": false,
        "expected_risk_level": "general",
        "forbidden_document_ids": [
          "MAN-SKMAGIC-WPU-IAC425-REV02"
        ],
        "forbidden_model_codes": [
          "WPUIAC425SNW",
          "WPUJAC104SWH"
        ],
        "product_model_code": "WPUJAC104DWH",
        "query": "냉수가 미지근할 때 기다려야 하는 시간과 확인 방법을 알려주세요.",
        "query_variant_type": "DIRECT",
        "source_case_ids": [
          "RAG-POS-COLD-TEMPERATURE"
        ]
      },
      "checks": [
        {
          "check_id": "EVIDENCE_POLICY_COHERENCE",
          "detail": "ANY",
          "status": "PASS"
        },
        {
          "check_id": "EVIDENCE_LINEAGE",
          "detail": "registry/page/section cross-check",
          "status": "PASS"
        },
        {
          "check_id": "FORBIDDEN_SCOPE",
          "detail": "target scope is not forbidden for positive cases",
          "status": "PASS"
        },
        {
          "check_id": "RISK_AND_GUIDANCE",
          "detail": "registry-derived when available",
          "status": "PASS"
        }
      ],
      "human_signoff_status": "PENDING",
      "required_human_checks": [
        "QUERY_AND_EVIDENCE_MEANING",
        "RISK_AND_GUIDANCE_APPROPRIATENESS",
        "FORBIDDEN_SCOPE_APPROPRIATENESS",
        "RECORD_REVIEWER_ID_DECISION_AND_REVIEWED_AT"
      ],
      "review_priority": "NORMAL",
      "source_review_context": [
        {
          "document_id": "MAN-SKMAGIC-WPU-JAC104D-JCC104D-REV00",
          "evidence_summary": "다량 출수, 냉수 기능 꺼짐, 방열팬 먼지와 냉각부 고장을 순서대로 구분합니다.",
          "evidence_unit_id": "EVD-WPUJAC104DWH-COLD-TEMPERATURE-001",
          "page_refs": [
            37
          ],
          "section_id": "JAC104-SECTION-TROUBLESHOOTING",
          "source_kind": "EVIDENCE_REGISTRY",
          "source_locator": "data/processed/structured/evidence/jac104_evidence_registry.jsonl",
          "verification_status": "TEXT_AND_VISUAL_VERIFIED"
        }
      ],
      "suggested_changes": []
    },
    {
      "assistant_assessment": "SUPPORTED",
      "assistant_reason": "검증된 Evidence Registry의 계보·위험도·안내 정책과 일치한다.",
      "case_id": "RAGV2-GOLD-0003",
      "case_snapshot": {
        "evidence_match_policy": "ANY",
        "expected_guidance_policy": "NORMAL",
        "expected_no_evidence": false,
        "expected_risk_level": "general",
        "forbidden_document_ids": [
          "MAN-SKMAGIC-WPU-IAC425-REV02"
        ],
        "forbidden_model_codes": [
          "WPUIAC425SNW",
          "WPUJAC104SWH"
        ],
        "product_model_code": "WPUJAC104DWH",
        "query": "제품에서 평소와 다른 소음이 날 때 확인할 사항은 무엇인가요?",
        "query_variant_type": "DIRECT",
        "source_case_ids": [
          "RAG-POS-NOISE"
        ]
      },
      "checks": [
        {
          "check_id": "EVIDENCE_POLICY_COHERENCE",
          "detail": "ANY",
          "status": "PASS"
        },
        {
          "check_id": "EVIDENCE_LINEAGE",
          "detail": "registry/page/section cross-check",
          "status": "PASS"
        },
        {
          "check_id": "FORBIDDEN_SCOPE",
          "detail": "target scope is not forbidden for positive cases",
          "status": "PASS"
        },
        {
          "check_id": "RISK_AND_GUIDANCE",
          "detail": "registry-derived when available",
          "status": "PASS"
        }
      ],
      "human_signoff_status": "PENDING",
      "required_human_checks": [
        "QUERY_AND_EVIDENCE_MEANING",
        "RISK_AND_GUIDANCE_APPROPRIATENESS",
        "FORBIDDEN_SCOPE_APPROPRIATENESS",
        "RECORD_REVIEWER_ID_DECISION_AND_REVIEWED_AT"
      ],
      "review_priority": "NORMAL",
      "source_review_context": [
        {
          "document_id": "MAN-SKMAGIC-WPU-JAC104D-JCC104D-REV00",
          "evidence_summary": "방열팬, 밸브, 컴프레서, 열교환 탱크에서 발생하는 정상 작동음을 설명하고 과도한 소음은 상담으로 전환합니다.",
          "evidence_unit_id": "EVD-WPUJAC104DWH-NOISE-001",
          "page_refs": [
            37
          ],
          "section_id": "JAC104-SECTION-TROUBLESHOOTING",
          "source_kind": "EVIDENCE_REGISTRY",
          "source_locator": "data/processed/structured/evidence/jac104_evidence_registry.jsonl",
          "verification_status": "TEXT_AND_VISUAL_VERIFIED"
        }
      ],
      "suggested_changes": []
    },
    {
      "assistant_assessment": "SUPPORTED",
      "assistant_reason": "검증된 Evidence Registry의 계보·위험도·안내 정책과 일치한다.",
      "case_id": "RAGV2-GOLD-0004",
      "case_snapshot": {
        "evidence_match_policy": "ANY",
        "expected_guidance_policy": "TOTAL_STOP",
        "expected_no_evidence": false,
        "expected_risk_level": "danger",
        "forbidden_document_ids": [
          "MAN-SKMAGIC-WPU-IAC425-REV02"
        ],
        "forbidden_model_codes": [
          "WPUIAC425SNW",
          "WPUJAC104SWH"
        ],
        "product_model_code": "WPUJAC104DWH",
        "query": "정수기에서 물이 새는 것 같을 때 안전하게 어떻게 조치해야 하나요?",
        "query_variant_type": "DIRECT",
        "source_case_ids": [
          "RAG-POS-LEAK"
        ]
      },
      "checks": [
        {
          "check_id": "EVIDENCE_POLICY_COHERENCE",
          "detail": "ANY",
          "status": "PASS"
        },
        {
          "check_id": "EVIDENCE_LINEAGE",
          "detail": "registry/page/section cross-check",
          "status": "PASS"
        },
        {
          "check_id": "FORBIDDEN_SCOPE",
          "detail": "target scope is not forbidden for positive cases",
          "status": "PASS"
        },
        {
          "check_id": "RISK_AND_GUIDANCE",
          "detail": "registry-derived when available",
          "status": "PASS"
        }
      ],
      "human_signoff_status": "PENDING",
      "required_human_checks": [
        "QUERY_AND_EVIDENCE_MEANING",
        "RISK_AND_GUIDANCE_APPROPRIATENESS",
        "FORBIDDEN_SCOPE_APPROPRIATENESS",
        "RECORD_REVIEWER_ID_DECISION_AND_REVIEWED_AT"
      ],
      "review_priority": "NORMAL",
      "source_review_context": [
        {
          "document_id": "MAN-SKMAGIC-WPU-JAC104D-JCC104D-REV00",
          "evidence_summary": "누수 발생 시 급수와 전원을 차단하고 즉시 상담으로 전환하는 안전 우선 조치입니다.",
          "evidence_unit_id": "EVD-WPUJAC104DWH-LEAK-001",
          "page_refs": [
            5,
            7,
            38
          ],
          "section_id": "JAC104-SECTION-TROUBLESHOOTING",
          "source_kind": "EVIDENCE_REGISTRY",
          "source_locator": "data/processed/structured/evidence/jac104_evidence_registry.jsonl",
          "verification_status": "TEXT_AND_VISUAL_VERIFIED"
        }
      ],
      "suggested_changes": []
    },
    {
      "assistant_assessment": "SUPPORTED",
      "assistant_reason": "검증된 Evidence Registry의 계보·위험도·안내 정책과 일치한다.",
      "case_id": "RAGV2-GOLD-0005",
      "case_snapshot": {
        "evidence_match_policy": "ANY",
        "expected_guidance_policy": "PARTIAL_STOP",
        "expected_no_evidence": false,
        "expected_risk_level": "caution",
        "forbidden_document_ids": [
          "MAN-SKMAGIC-WPU-IAC425-REV02"
        ],
        "forbidden_model_codes": [
          "WPUIAC425SNW",
          "WPUJAC104SWH"
        ],
        "product_model_code": "WPUJAC104DWH",
        "query": "정수에서 이상한 맛이나 냄새가 날 때 확인할 내용은 무엇인가요?",
        "query_variant_type": "DIRECT",
        "source_case_ids": [
          "RAG-POS-TASTE-ODOR"
        ]